"Planta ","NOMBRES COMUNES","N0MBRE CIENTÌFICO","Propiedad","Parte","Tipo de uso","Componentes","Contraindicaciones"
"CANELA","Canelo de Ceilan, canelo.","Cinnamomum zeylanicum Nees.","Eupeptico","Corteza.","Interno","aldehido cinamico, eugenol, a- felandreno, P-linalool, acetato de linalilo, benzaldehido, P-cariofileno, acido benzoico y cinamato de bencilo. taninos, cumarinas, azucares y resina. ","Hipersensibilidad a los componentes de la planta. No se recomienda a ninos menores de dos anos ni en mujeres embarazadas o lactantes "
"QUINA","Quina amarilla, azuceno, cascarilla, quina calisaya, quina colorada, quina roja, quina bofuda, cascarilla amarga.","Cinchona pubescens Vahl.","Eupèptica","Corteza","Interno","alcaloides siendo los principales: quinina, quinidina, cinconina y cinconidina.. Contiene ademas acido quinico, quinovico, quinotanico, materias colorantes, resinas, gomas, taninos, lignina, trazas de aceite esencial, flavonoides y compuestos antraquinonicos ","Embarazo, hipersensibilidad a los componentes de la planta, gastritis, ulceras gastroduodenales. "
"SALVIA","Salvia, salima.","Salvia officinalis L.","Eupeptico","Hojas","Interno/Externo","Aceite esencial que contiene a y 0-tuyona, monoterpenos (cineol, alcanfor), sesquiterpenos (humuleno, cariofileno), taninos, acido rosmarinico, flavonoides, 0- sitosterol, estigmasterol, a y 0-amirina, betulina, acidos ursolicos, borneol, saponinas, un polisacarido compuesto por galactosa, metilgalactosa, glucosa, manosa, arabinosa, xilosa y ramnosa ","Embarazo y lactancia. Ninos menores de 2 anos."
"AJENJO","Ajenjo, artemisia amarga, hierba santa, absinthium.","Artemisia absinthium L.","Estimulante del Apetito ","Flores","Oral","flavonoides,tuyona, acetato de bornilo, acetato de sabinilotuyol, cineol, linalol, lactonas terpenicas, absintina,artabsina","Epilepsia y embarazo. Evitar su uso prolongado. Por sobredosis o uso prolongado pueden aparecer sintomas de toxicidad debidos a la tuyona."
"CARDAMOMO","Cardamomo, cardamomi, cardamomo menor.","Elettaria cardamomun L.","Estimulante  del Apetito","Semillas.","Interno","1,8-cineol, a-felandreno, a y 0-pineno, a-terpineno, a-terpenil-acetato, borneol, camfeno, alcanfor, carbohidratos, citronelol, limoneno, linalool, almidon, pentosano, acidos. aceite esencial (2-8%) el cual contiene citronelol, 1,8- cineol, linalil acetato, linalool, sabineno, nerolidol, a-terpineol, geraniol, neral, acetato de geranilo y limoneno caprilico, caproico, palmitico, oleico y linoleico, resinas y minerales.","Evitar su uso en personas gestantes o lactantes. No administrar ni aplicar topicamente a ninos menores de seis anos ni a personas con alergias respiratorias o con hipersensibilidad conocida a este u otros aceites esenciales."
"GENCIANA","Genciana, genciana mayor, genciana amarilla, xensa, errosta, gengiba, junciana, xaranzana.","Gentiana lutea L.","Estimulante del apetito","Raices y Rizomas","Interno","Secoiridoides (Swertiamarina, genciopicrosido, amarogencina, swerosido), xantonas (gentisina, isogentisina), xantonas glicosiladas (genciosidos), fitosteroles, pectinas. ","Embarazo, hipertension. "
"MILENRAMA","Milenrama, cientoenrama, maquilea, hierba del carpintero, hierba de Aquiles, colchon de pobre, cola de ardilla, alhucema, mil flores, mil hojas.","Achillea millefolium L.","Estimulante del apetito","Sumidades floridas.","Interno","camazuleno, cariofileno, azulenos, acetato de bornilo, p-cimeno, linalool, pulegona, eugenol, timol, a- humuleno, bisaboleno, acidos fenolicos, lactonas sesquiterpenicas, flavonoides (apigenina y luteolina), alcaloides (achileina, estacridina, betaina y colina), tiofenos, a- pineno, tuyona, 0-pineno, 0-terpineno, 0-felandreno, p-cimeno y alcanfor ","Embarazo y lactancia. Dispepsias. "
"RÀBANO","Rabano, rabano blanco.","Raphanus sativus L.","Estimulante del apetito","Raiz","Interno","glucosidos, antocianinas, acidos ferulico y cumarinico, peptidos, peroxidasas, alcaloides, componentes sulfuricos, alilisotiocianato, saponinas, taninos, flavonoides, compuestos fenolicos, cumarinas, esteroles y esteres de acido sinapinico ","El rabano contiene concentraciones altas de glucosinolato, sustancia que actua sobre la glandula tiroides presentando un efecto antitiroideo, inductor de bocio."
"ROMERO","Romero, romeo, rosmarino, aroma de mar.","Rosmarinus officinalis L.","Estimulante del apetito ","Hojas y flores.","Interno","acidos cafeico, clorogenico y rosmarinico, flavonas (apigenina y luteolina), lactonas diterpenicas (apicrosalvina), alcaloide rosmaricina en baja concentracion, taninos, flavonoides, un aceite esencial que contiene pineno, cineol, alcanfor y limoneno ","Por uso interno: embarazo, lactancia, gastritis, obstruccion biliar. Por via topica, no se debe administrar a ninos menores de 6 anos"
"CANELA","Canelo de Ceilan, canelo.","Cinnamomum zeylanicum Nees.","Aperitivo","Corteza.","Interno","aldehido cinamico, eugenol, a- felandreno, P-linalool, acetato de linalilo, benzaldehido, P-cariofileno, acido benzoico y cinamato de bencilo. taninos, cumarinas, azucares y resina. ","Hipersensibilidad a los componentes de la planta. No se recomienda a ninos menores de dos anos ni en mujeres embarazadas o lactantes "
"CIMICIFUGA","Hierba de San Cristobal, raices de cohosh negro, raiz de culebra negra, cimicifuga, hierba rica, raiz de cascabel, raiz de serpiente de cascabel, hierba de cascabel.","Cimicifuga racemosa (L.) Nutt.","Aperitivo","Rizomas","Interno","Alcaloides quinolizidinicos, glucosidos triterpenicos derivados del cicloartano como la acteina, taninos, resina, principios amargos, compuestos estrogenicos y acidos organicos: acetico, butirico, formico, galico, oleico, palmitico y salicilico. la formocetina, isoflavona","Hipersensibilidad a los componentes, embarazo, lactancia. "
"CULANTRO","Culantro, cilantro, coriander, chicoria, culantro de coyote, culantron, culantro de sabana, culantro hediondo, cimarron, pericon, cilantron, acopate.","Eryngium foetidum L.","Aperitivo","Partes aereas.","Interno","flavonoides, saponinas, triterpenos, taninos, caroteno, riboflavina, estigmasterol, campesterol, beta-sitosterol y aceite esencial constituido principalmente por alfa-pineno ","No usar durante el embarazo, lactancia, ni en ninos menores de 3 anos."
"GINSENG","Ginseng, mandragora.","Panax ginseng C.C. Mey.","Aperitivo","Raiz.","Interno","conocidos como panaxosidos o ginsenosidos los cuales pueden hidrolizarse liberando las agliconas que se denominan panaxadioles o panaxatrioles. Contiene ademas aceite esencial, polisacaridos, proteinas, acidos fenolicos y esteroides (","Embarazo, lactancia, hipertension y ansiedad."
"MARRUBIO BLANCO","Marrubio blanco, marrubio, juanrubio, malvarrubia, matico.","Marrubium vulgare L.","Aperitivo","Sumidades floridas.","Interno","Lactonas diterpenicas (marrubiina, premarrubiina, marrubiol, peregrinol, vulgarol), flavonoides (apigenina, luteolina y sus derivados, quercetina y sus derivados, vitexina), acidos fenolicos y derivados (cafeico, clorogenico, cafeilquinico), taninos, saponinas, cumarinas, alcaloides, esteroles, mucilago, pectina y aceite esencial que contiene 0- pineno, bisabolol y 0-elemona","Contraindicado en pacientes con problemas cardiacos o renales."
"OREGANO","Oregano, oregano europeo, oregano de Espana, mejorana silvestre, oregano silvestre.","Origanum vulgare L.","Aperitivo","Sumidades floridas.","Interno","aceite volatil compuesto principalmente por carvacrol, borneol, terpineol, timol y cimeno. En la planta se encuentran acidos fenolicos (cafeico, clorogenico, rosmarinico), flavonoides derivados de apigenol y de kamferol, taninos y minerales","Embarazo y lactancia. Hipersensibilidad a los componentes de la planta. "
"SAUCE","Sauce, sauce chileno, sauce amargo, sauz.","Salix humboldtiana ","Aperitivo","Corteza y hojas.","Interno","salicina, un glucosido que se hidroliza produciendo saligenina y dextrosa. Ademas se encuentran taninos, aceite esencial, flavonoides y un colorante. ","Hipersensibilidad a alguno de los componentes de la planta y a los salicilatos. "
"MARRUBIO BLANCO","Marrubio blanco, marrubio, juanrubio, malvarrubia, matico.","Marrubium vulgare L.","Digestivo,","Sumidades floridas.","Interno","Lactonas diterpenicas (marrubiina, premarrubiina, marrubiol, peregrinol, vulgarol), flavonoides (apigenina, luteolina y sus derivados, quercetina y sus derivados, vitexina), acidos fenolicos y derivados (cafeico, clorogenico, cafeilquinico), taninos, saponinas, cumarinas, alcaloides, esteroles, mucilago, pectina y aceite esencial que contiene 0- pineno, bisabolol y 0-elemona","Contraindicado en pacientes con problemas cardiacos o renales."
"OREGANO","Oregano, oregano europeo, oregano de Espana, mejorana silvestre, oregano silvestre.","Origanum vulgare L.","Digestivo","Sumidades floridas.","Interno","aceite volatil compuesto principalmente por carvacrol, borneol, terpineol, timol y cimeno. En la planta se encuentran acidos fenolicos (cafeico, clorogenico, rosmarinico), flavonoides derivados de apigenol y de kamferol, taninos y minerales","Embarazo y lactancia. Hipersensibilidad a los componentes de la planta. "
"OREGANO","Oregano, oregano europeo, oregano de Espana, mejorana silvestre, oregano silvestre.","Origanum vulgare L.","Carminativo","Sumidades floridas.","Interno","aceite volatil compuesto principalmente por carvacrol, borneol, terpineol, timol y cimeno. En la planta se encuentran acidos fenolicos (cafeico, clorogenico, rosmarinico), flavonoides derivados de apigenol y de kamferol, taninos y minerales","Embarazo y lactancia. Hipersensibilidad a los componentes de la planta. "
"OREGANO","Oregano, oregano europeo, oregano de Espana, mejorana silvestre, oregano silvestre.","Origanum vulgare L.","Carminativo","Sumidades floridas.","Interno","aceite volatil compuesto principalmente por carvacrol, borneol, terpineol, timol y cimeno. En la planta se encuentran acidos fenolicos (cafeico, clorogenico, rosmarinico), flavonoides derivados de apigenol y de kamferol, taninos y minerales","Embarazo y lactancia. Hipersensibilidad a los componentes de la planta. "
"PRONTO ALIVIO","Falsa melissa, pronto alivio, quita dolor, menta americana, poleo, salvia americana, toronjil de Espana, toronjil isleno, toronjil mentol, hierba del negro, mirto, orozul, salva-brava, cidrila, orozul de menta, orozul de palo, salvavida, cidrela, malojillo extranjero, curalotodo.","Lippia alba ","Carminativo","Partes aereas","Interno/Externo","alcaloides, flavonoides, taninos e iridoides. Por estudios efectuados con el aceite esencial de las hojas es posible distinguir en esta especie tres quimiotipos citral- mirceno, citral-limoneno y carvona-limoneno. En las hojas se han encontrado alcaloides, flavonoides, aceite esencial (geranial, cariofileno, citronelal y otros terpenos) ","Decoccion e infusion de las hojas de la planta."
"SALVIA","Salvia, salima.","Salvia officinalis L.","Carminativo","Hojas","Interno/Externo","Aceite esencial que contiene a y 0-tuyona, monoterpenos (cineol, alcanfor), sesquiterpenos (humuleno, cariofileno), taninos, acido rosmarinico, flavonoides, 0- sitosterol, estigmasterol, a y 0-amirina, betulina, acidos ursolicos, borneol, saponinas, un polisacarido compuesto por galactosa, metilgalactosa, glucosa, manosa, arabinosa, xilosa y ramnosa ","Embarazo y lactancia. Ninos menores de 2 anos."
"TORONJIL","Toronjil.","Melissa officinalis L.","Carminativo","Tallos y hojas.","Interno","elementos minerales, taninos, acidos fenolicos (cafeico, clorogenico, rosmarinico), aceite esencial con aldehidos terpenicos (citral, citronelal, metilcitronelal), flavonoides (luteolina, rhamanzina), sesquiterpenos (0- cariofileno, germacreno D) y alcoholes terpenicos (geraniol, linalool, acetato de geranilo)","Debe administrarse con precaucion a personas que requieran animo vigilante."
"VALERIANA OFFICINALIS","Valeriana","Valeriana officinalis L.","Carminativo","Raiz y rizomas.","Interno","valepotriatos, diovaltrato, acevaltrato, isovaltrato, acido clorogenico, colina, acido cafeico, acido bohemico. Acido isovalerianico e isovalerianato de bornilo, acidos valerianicos, acetico, formico y malico, alcaloides y glucosidos. El aceite esencial contiene acetato de bornilo, cariofileno, terpineno, canfeno, timol, valeranol, isovalerato, a y 0-pineno, borneol, p-cimeno, limoneno, acido valerico ","Debe tenerse precaucion con el uso simultaneo con alcohol y otros depresores del SNC y en personas que requieran animo vigilante. "
"ZANAHORIA","Zanahoria, acenoria, azanoria, sinoria, forrajera.","Daucus carota L.","Carminativo","Raiz","Interno","Las raices contienen caroteno, azucares, sitosterina, estigmasterina, lecitina, glutamina, pectina, vitaminas y proteinas. El aceite esencial contiene alfa-pineno y otros terpenos. ",""
